{
  "version": "0.3",
  "rightsReview": {
    "status": "approved",
    "reviewer": "Project owner visual approval plus project-local provenance and geometry validation",
    "reviewedAt": "2026-09-22T00:00:00+08:00",
    "distributionScope": "ThemeTeam project runtime packaging only; no original Theme Hospital assets imported"
  },
  "atlases": [
    {
      "id": "agents",
      "image": "/assets/office/office-agents.v0.3.png",
      "sha256": "58bfc049aa5916f4abce2813f41b41941edb324b482033febb20ea0ccfcad232",
      "width": 640,
      "height": 576,
      "source": "Approved v0.3 generated role grids, deterministically alpha-cleaned and packed by tests/pack_m1_agent_atlas_v03.cjs",
      "author": "ThemeTeam project visual pipeline",
      "license": "Project-local original generated asset approved by the project owner for ThemeTeam runtime packaging",
      "frames": [
        {
          "id": "pm-idle-NE",
          "x": 0,
          "y": 0,
          "width": 64,
          "height": 96,
          "pivotX": 32,
          "pivotY": 94,
          "kind": "agent"
        },
        {
          "id": "pm-walk1-NE",
          "x": 64,
          "y": 0,
          "width": 64,
          "height": 96,
          "pivotX": 32,
          "pivotY": 94,
          "kind": "agent"
        },
        {
          "id": "pm-walk2-NE",
          "x": 128,
          "y": 0,
          "width": 64,
          "height": 96,
          "pivotX": 32,
          "pivotY": 94,
          "kind": "agent"
        },
        {
          "id": "pm-sit-NE",
          "x": 192,
          "y": 0,
          "width": 64,
          "height": 96,
          "pivotX": 32,
          "pivotY": 94,
          "kind": "agent"
        },
        {
          "id": "pm-work-NE",
          "x": 256,
          "y": 0,
          "width": 64,
          "height": 96,
          "pivotX": 32,
          "pivotY": 94,
          "kind": "agent"
        },
        {
          "id": "pm-idle-SE",
          "x": 320,
          "y": 0,
          "width": 64,
          "height": 96,
          "pivotX": 32,
          "pivotY": 94,
          "kind": "agent"
        },
        {
          "id": "pm-walk1-SE",
          "x": 384,
          "y": 0,
          "width": 64,
          "height": 96,
          "pivotX": 32,
          "pivotY": 94,
          "kind": "agent"
        },
        {
          "id": "pm-walk2-SE",
          "x": 448,
          "y": 0,
          "width": 64,
          "height": 96,
          "pivotX": 32,
          "pivotY": 94,
          "kind": "agent"
        },
        {
          "id": "pm-sit-SE",
          "x": 512,
          "y": 0,
          "width": 64,
          "height": 96,
          "pivotX": 32,
          "pivotY": 94,
          "kind": "agent"
        },
        {
          "id": "pm-work-SE",
          "x": 576,
          "y": 0,
          "width": 64,
          "height": 96,
          "pivotX": 32,
          "pivotY": 94,
          "kind": "agent"
        },
        {
          "id": "pm-idle-SW",
          "x": 0,
          "y": 96,
          "width": 64,
          "height": 96,
          "pivotX": 32,
          "pivotY": 94,
          "kind": "agent"
        },
        {
          "id": "pm-walk1-SW",
          "x": 64,
          "y": 96,
          "width": 64,
          "height": 96,
          "pivotX": 32,
          "pivotY": 94,
          "kind": "agent"
        },
        {
          "id": "pm-walk2-SW",
          "x": 128,
          "y": 96,
          "width": 64,
          "height": 96,
          "pivotX": 32,
          "pivotY": 94,
          "kind": "agent"
        },
        {
          "id": "pm-sit-SW",
          "x": 192,
          "y": 96,
          "width": 64,
          "height": 96,
          "pivotX": 32,
          "pivotY": 94,
          "kind": "agent"
        },
        {
          "id": "pm-work-SW",
          "x": 256,
          "y": 96,
          "width": 64,
          "height": 96,
          "pivotX": 32,
          "pivotY": 94,
          "kind": "agent"
        },
        {
          "id": "pm-idle-NW",
          "x": 320,
          "y": 96,
          "width": 64,
          "height": 96,
          "pivotX": 32,
          "pivotY": 94,
          "kind": "agent"
        },
        {
          "id": "pm-walk1-NW",
          "x": 384,
          "y": 96,
          "width": 64,
          "height": 96,
          "pivotX": 32,
          "pivotY": 94,
          "kind": "agent"
        },
        {
          "id": "pm-walk2-NW",
          "x": 448,
          "y": 96,
          "width": 64,
          "height": 96,
          "pivotX": 32,
          "pivotY": 94,
          "kind": "agent"
        },
        {
          "id": "pm-sit-NW",
          "x": 512,
          "y": 96,
          "width": 64,
          "height": 96,
          "pivotX": 32,
          "pivotY": 94,
          "kind": "agent"
        },
        {
          "id": "pm-work-NW",
          "x": 576,
          "y": 96,
          "width": 64,
          "height": 96,
          "pivotX": 32,
          "pivotY": 94,
          "kind": "agent"
        },
        {
          "id": "developer-idle-NE",
          "x": 0,
          "y": 192,
          "width": 64,
          "height": 96,
          "pivotX": 32,
          "pivotY": 94,
          "kind": "agent"
        },
        {
          "id": "developer-walk1-NE",
          "x": 64,
          "y": 192,
          "width": 64,
          "height": 96,
          "pivotX": 32,
          "pivotY": 94,
          "kind": "agent"
        },
        {
          "id": "developer-walk2-NE",
          "x": 128,
          "y": 192,
          "width": 64,
          "height": 96,
          "pivotX": 32,
          "pivotY": 94,
          "kind": "agent"
        },
        {
          "id": "developer-sit-NE",
          "x": 192,
          "y": 192,
          "width": 64,
          "height": 96,
          "pivotX": 32,
          "pivotY": 94,
          "kind": "agent"
        },
        {
          "id": "developer-work-NE",
          "x": 256,
          "y": 192,
          "width": 64,
          "height": 96,
          "pivotX": 32,
          "pivotY": 94,
          "kind": "agent"
        },
        {
          "id": "developer-idle-SE",
          "x": 320,
          "y": 192,
          "width": 64,
          "height": 96,
          "pivotX": 32,
          "pivotY": 94,
          "kind": "agent"
        },
        {
          "id": "developer-walk1-SE",
          "x": 384,
          "y": 192,
          "width": 64,
          "height": 96,
          "pivotX": 32,
          "pivotY": 94,
          "kind": "agent"
        },
        {
          "id": "developer-walk2-SE",
          "x": 448,
          "y": 192,
          "width": 64,
          "height": 96,
          "pivotX": 32,
          "pivotY": 94,
          "kind": "agent"
        },
        {
          "id": "developer-sit-SE",
          "x": 512,
          "y": 192,
          "width": 64,
          "height": 96,
          "pivotX": 32,
          "pivotY": 94,
          "kind": "agent"
        },
        {
          "id": "developer-work-SE",
          "x": 576,
          "y": 192,
          "width": 64,
          "height": 96,
          "pivotX": 32,
          "pivotY": 94,
          "kind": "agent"
        },
        {
          "id": "developer-idle-SW",
          "x": 0,
          "y": 288,
          "width": 64,
          "height": 96,
          "pivotX": 32,
          "pivotY": 94,
          "kind": "agent"
        },
        {
          "id": "developer-walk1-SW",
          "x": 64,
          "y": 288,
          "width": 64,
          "height": 96,
          "pivotX": 32,
          "pivotY": 94,
          "kind": "agent"
        },
        {
          "id": "developer-walk2-SW",
          "x": 128,
          "y": 288,
          "width": 64,
          "height": 96,
          "pivotX": 32,
          "pivotY": 94,
          "kind": "agent"
        },
        {
          "id": "developer-sit-SW",
          "x": 192,
          "y": 288,
          "width": 64,
          "height": 96,
          "pivotX": 32,
          "pivotY": 94,
          "kind": "agent"
        },
        {
          "id": "developer-work-SW",
          "x": 256,
          "y": 288,
          "width": 64,
          "height": 96,
          "pivotX": 32,
          "pivotY": 94,
          "kind": "agent"
        },
        {
          "id": "developer-idle-NW",
          "x": 320,
          "y": 288,
          "width": 64,
          "height": 96,
          "pivotX": 32,
          "pivotY": 94,
          "kind": "agent"
        },
        {
          "id": "developer-walk1-NW",
          "x": 384,
          "y": 288,
          "width": 64,
          "height": 96,
          "pivotX": 32,
          "pivotY": 94,
          "kind": "agent"
        },
        {
          "id": "developer-walk2-NW",
          "x": 448,
          "y": 288,
          "width": 64,
          "height": 96,
          "pivotX": 32,
          "pivotY": 94,
          "kind": "agent"
        },
        {
          "id": "developer-sit-NW",
          "x": 512,
          "y": 288,
          "width": 64,
          "height": 96,
          "pivotX": 32,
          "pivotY": 94,
          "kind": "agent"
        },
        {
          "id": "developer-work-NW",
          "x": 576,
          "y": 288,
          "width": 64,
          "height": 96,
          "pivotX": 32,
          "pivotY": 94,
          "kind": "agent"
        },
        {
          "id": "tester-idle-NE",
          "x": 0,
          "y": 384,
          "width": 64,
          "height": 96,
          "pivotX": 32,
          "pivotY": 94,
          "kind": "agent"
        },
        {
          "id": "tester-walk1-NE",
          "x": 64,
          "y": 384,
          "width": 64,
          "height": 96,
          "pivotX": 32,
          "pivotY": 94,
          "kind": "agent"
        },
        {
          "id": "tester-walk2-NE",
          "x": 128,
          "y": 384,